{
  "schema": "dokion.registry-root.v1",
  "source": {
    "id": "example.registry",
    "name": "example-registry",
    "transport": "https",
    "location": "https://registry.example.test/root.json"
  },
  "generated_at": "2026-08-01T07:00:00Z",
  "expires_at": "2026-08-02T07:00:00Z",
  "indexes": [
    {
      "location": "https://registry.example.test/index.json",
      "digest": "sha256:aaaaaaaaaaaaaaaaaaaaaaaaaaaaaaaaaaaaaaaaaaaaaaaaaaaaaaaaaaaaaaaa",
      "size": 1024
    }
  ],
  "authority": {
    "selection_authority": false,
    "substitution_authority": false,
    "installation_authority": false,
    "activation_authority": false,
    "execution_authority": false
  }
}
